{
  "exp": 1458057712,
  "iat": 1458047712,
  "jti": "6b383088-b8f8-4167-8847-c4aaeda8fe16",
  "tx_id": "0f534ffc-9442-414c-b39f-a756b4adc6cb",
  "version": "v2",
  "account_service_url": "https://upstream.example.com",
  "case_id": "628256cf-5c78-4896-8bec-f0ddb69aaa11",
  "channel": "RH",
  "collection_exercise_sid": "9ced8dc9-f2f3-49f3-95af-2f3ca0b74ee3",
  "region_code": "GB-WLS",
  "response_expires_at": "2022-12-01T00:00:00+00:00",
  "response_id": "QzXMrPqoLiyEyerrED88AbkQoQK0sVVX72ZtVphHr0w=",
  "schema_name": "adhoc_0001",
  "survey_metadata": {
    "data": {
      "case_ref": "1000000000000001",
      "qid": "0130000000000300",
      "BLOOD_TEST_BARCODE": "BLT11111111",
      "SWAB_TEST_BARCODE": "swT11111111",
      "PARTICIPANT_ID": "DHRF-123456789012",
      "TEST_QUESTIONS": "F",
      "COLLEX_OPEN_DATE": "08 Jan 2023",
      "COLLEX_CLOSE_DATE": "28 Jan 2023",
      "FIRST_NAME": "Vinny",
      "WINDOW_START_DATE": "2023-01-08",
      "WINDOW_CLOSE_DATE": "2023-01-28",
      "PORTAL_ID": "1234567",
      "PARTICIPANT_WINDOW_ID": "DHRF-123456789012-001"
    },
    "receipting_keys": ["qid"]
  }
}
